{
  "$schema": "../schemas/campaign.schema.json",
  "schema_version": "1.0",
  "name": "baseline-capacity-20260906",
  "defaults": {
    "url": "http://127.0.0.1:8000/v1/completions",
    "model": "Qwen/Qwen2.5-0.5B-Instruct",
    "model_metadata": {
      "revision": "7ae557604adf67be50417f59c2c2f167def9a775",
      "dtype": "half",
      "quantization": null,
      "max_model_len": 2200
    },
    "server": {
      "discovery": "explicit",
      "launch_flags": [
        "--host", "127.0.0.1",
        "--port", "8000",
        "--dtype", "half",
        "--gpu-memory-utilization", "0.85",
        "--max-model-len", "2200"
      ]
    },
    "telemetry": {
      "gpu": {"enabled": true, "interval_s": 1.0, "timeout_s": 5.0},
      "vllm": {
        "enabled": true,
        "url": "http://127.0.0.1:8000/metrics",
        "interval_s": 1.0,
        "timeout_s": 5.0
      }
    },
    "num_requests": 256,
    "warmups": 1,
    "repeats": 3,
    "seed": 20260906,
    "stream": true,
    "temperature": 0.0,
    "timeout": 300,
    "store_response": false
  },
  "workloads": [
    {"name": "mixed", "config": "workloads/baseline-20260906-mixed.json"},
    {"name": "long-prefill", "config": "workloads/baseline-20260906-long-prefill.json"},
    {"name": "long-decode", "config": "workloads/baseline-20260906-long-decode.json"},
    {"name": "short", "config": "workloads/baseline-20260906-short.json"}
  ],
  "sweeps": [
    {
      "name": "mixed",
      "workload": "mixed",
      "concurrency": [16, 24, 32, 64, 96, 128, 256]
    },
    {
      "name": "long-prefill",
      "workload": "long-prefill",
      "concurrency": [16, 24, 32, 64, 96, 128, 256]
    },
    {
      "name": "long-decode",
      "workload": "long-decode",
      "concurrency": [16, 24, 32, 64, 96, 128, 256]
    },
    {
      "name": "short",
      "workload": "short",
      "concurrency": [16, 24, 32, 64, 96, 128, 256]
    }
  ]
}
